{
  "schema_version": "1.0",
  "kind": "render_gate",
  "status": "pass",
  "render_manifest_sha256": "7427db63eb65ab6f1f86de488642c2303a440528265605f02b56f63d98cc0dfe",
  "checks": [
    {
      "name": "same_scene_real_png_export",
      "status": "pass",
      "details": {
        "pages": 17,
        "import_sha256": "a68dc85a852a7a481a9a5c35937f43275bbf8739c0813c4c859a75b33508f2e5"
      }
    },
    {
      "name": "original_phone_grayscale_review",
      "status": "pass",
      "details": {
        "user_approval_sha256": "93fb26c11c78f8edfebe0d795b0f8c6d42383aa16eafc9c56dad2f5f42e33004"
      }
    },
    {
      "name": "independent_visual_review",
      "status": "pass",
      "details": {
        "review_sha256": "4dfe74036cbb6d8ed8609623ffca6d174ec4a22b188cc1f8df015dcaeffe0ebd",
        "verdict": "TARGET",
        "scope": "既有完整审核核验与当前整包横审合并，非补造历史制作"
      }
    }
  ],
  "human_review_required": false,
  "independent_review_required": false
}
